{
 "built_by": "tools/zero_paper_ledger.py",
 "zero_papers": [
  {
   "school": "princeton",
   "pi": "Abhishek Bhattacharjee",
   "departments": [
    "Computer Science"
   ],
   "rank": null,
   "title": null,
   "diagnosis": "joined_after_window",
   "verdict": "zero_is_right",
   "reason": "Reviewed appointment starts 2026-07-01; his one Princeton-identified paper predates it. No Princeton-affiliated work since he joined yet.",
   "evidence": null,
   "funnel": {
    "name_hits": 190,
    "school_affiliated": 88,
    "identity": 1,
    "dblpTitles": 0,
    "dblpDois": 0,
    "verifiedWorks": 0
   },
   "outside_appointment_by_year": {
    "2017": 1
   },
   "periods": [
    [
     "2026-07-01",
     null
    ]
   ],
   "listing_years": [
    2026
   ],
   "students": 1
  },
  {
   "school": "princeton",
   "pi": "Robert Schapire",
   "departments": [
    "Computer Science"
   ],
   "rank": null,
   "title": null,
   "diagnosis": "no_appointment_coverage",
   "verdict": "zero_is_right",
   "reason": "Listed only as (Visiting) Lecturer 2018-2021 while at Microsoft Research NYC; of 46 name hits in 2016-2026 only one (2016) lists Princeton, before the listings.",
   "evidence": null,
   "funnel": {
    "name_hits": 46,
    "school_affiliated": 1,
    "identity": 1,
    "dblpTitles": 0,
    "dblpDois": 0,
    "verifiedWorks": 0
   },
   "outside_appointment_by_year": {
    "2016": 1
   },
   "periods": [],
   "listing_years": [
    2018,
    2019,
    2020,
    2021
   ],
   "students": 3
  },
  {
   "school": "princeton",
   "pi": "Andrea LaPaugh",
   "departments": [
    "Computer Science"
   ],
   "rank": null,
   "title": null,
   "diagnosis": "no_output_found",
   "verdict": "zero_is_right",
   "reason": "Teaching-focused professor (undergraduate representative) until retirement; no 2016-2026 works in OpenAlex or DBLP under her names.",
   "evidence": null,
   "funnel": {
    "dblpTitles": 0,
    "dblpDois": 0,
    "verifiedWorks": 0
   },
   "outside_appointment_by_year": {},
   "periods": [],
   "listing_years": [
    2016,
    2017,
    2018,
    2019,
    2020,
    2021,
    2022,
    2023,
    2024,
    2025
   ],
   "students": 6
  },
  {
   "school": "cmu",
   "pi": "William L Scherlis",
   "departments": [
    "S3D"
   ],
   "rank": "ladder",
   "title": "Professor",
   "diagnosis": "identity_unanchored",
   "verdict": "zero_is_right",
   "reason": "DBLP has two 2016-2026 works: a 2019 arXiv preprint and IEEE S&P Magazine 2022 \"Formal Methods at Scale\", whose byline lists DARPA (he directed DARPA I2O), not CMU.",
   "evidence": [
    "https://api.openalex.org/works/doi:10.1109/MSEC.2022.3158842"
   ],
   "funnel": {
    "name_hits": 3,
    "school_affiliated": 1,
    "dblpTitles": 2,
    "dblpDois": 2,
    "verifiedWorks": 0
   },
   "outside_appointment_by_year": {},
   "periods": [],
   "listing_years": [
    2016,
    2017,
    2018,
    2019,
    2020,
    2021,
    2022,
    2023,
    2024,
    2025,
    2026
   ],
   "students": 5
  },
  {
   "school": "cmu",
   "pi": "Randi Williams",
   "departments": [
    "HCII"
   ],
   "rank": "research",
   "title": "Assistant Research Professor",
   "diagnosis": "no_school_affiliation",
   "verdict": "zero_is_right",
   "reason": "Assistant Research Professor first listed 2026 (HCII); her 26 name hits list MIT (her PhD), none CMU yet.",
   "evidence": null,
   "funnel": {
    "name_hits": 26,
    "dblpTitles": 21,
    "dblpDois": 22,
    "verifiedWorks": 0
   },
   "outside_appointment_by_year": {},
   "periods": [],
   "listing_years": [
    2026
   ],
   "students": 1
  },
  {
   "school": "epfl",
   "pi": "Amin Shokrollahi",
   "departments": [
    "ALGO"
   ],
   "rank": "emeritus",
   "title": "Emeritus",
   "diagnosis": "no_school_affiliation",
   "verdict": "zero_is_right",
   "reason": "All six verified 2016-2025 works (ISSCC, VLSI, JSSC, CICC, MWSCAS) are Kandou Bus industry papers whose bylines do not list EPFL.",
   "evidence": null,
   "funnel": {
    "name_hits": 1,
    "dblpTitles": 6,
    "dblpDois": 6,
    "verifiedWorks": 6
   },
   "outside_appointment_by_year": {},
   "periods": [],
   "listing_years": [
    2016,
    2017,
    2018,
    2019,
    2020,
    2021,
    2022,
    2023,
    2024,
    2025,
    2026
   ],
   "students": 2
  },
  {
   "school": "epfl",
   "pi": "Jean-Dominique Decotignie",
   "departments": [
    "LAMS"
   ],
   "rank": "emeritus",
   "title": "Emeritus",
   "diagnosis": "not_in_school_sweep",
   "verdict": "zero_is_right",
   "reason": "DBLP has 12 works 2016-2019 (WSN/MAC with C. Rojas, L. Bergamini); OpenAlex bylines list CSEM Neuchâtel, not EPFL.",
   "evidence": [
    "https://api.openalex.org/works/doi:10.1109/WiMOB.2018.8589096",
    "https://api.openalex.org/works/doi:10.1145/3273905.3273919"
   ],
   "funnel": {
    "dblpTitles": 12,
    "dblpDois": 10,
    "verifiedWorks": 0
   },
   "outside_appointment_by_year": {},
   "periods": [],
   "listing_years": [
    2016,
    2017,
    2018,
    2019,
    2020,
    2021,
    2022,
    2023,
    2024,
    2025,
    2026
   ],
   "students": 1
  },
  {
   "school": "mit",
   "pi": "Christopher Terman",
   "departments": [
    "CSAIL",
    "EECS"
   ],
   "rank": "emeritus",
   "title": "Senior Lecturer (Emeritus) , [CS]",
   "diagnosis": "no_output_found",
   "verdict": "zero_is_right",
   "reason": "Senior Lecturer (teaching; emeritus later); no 2016-2026 works in DBLP or under his OpenAlex id with MIT.",
   "evidence": null,
   "funnel": {
    "dblpTitles": 0,
    "dblpDois": 0,
    "verifiedWorks": 0
   },
   "outside_appointment_by_year": {},
   "periods": [],
   "listing_years": [
    2016,
    2017,
    2018,
    2019,
    2020,
    2021,
    2022,
    2023,
    2024,
    2025,
    2026
   ],
   "students": 3
  },
  {
   "school": "mit",
   "pi": "Michael Sipser",
   "departments": [
    "CSAIL"
   ],
   "rank": "ladder_faculty",
   "title": "Professor",
   "diagnosis": "no_school_affiliation",
   "verdict": "zero_is_right",
   "reason": "No DBLP records 2016-2026; the 7 OpenAlex name hits do not list MIT (textbook editions and namesakes).",
   "evidence": null,
   "funnel": {
    "name_hits": 7,
    "dblpTitles": 0,
    "dblpDois": 0,
    "verifiedWorks": 0
   },
   "outside_appointment_by_year": {},
   "periods": [],
   "listing_years": [
    2016,
    2017,
    2018,
    2019,
    2020,
    2021,
    2022,
    2023,
    2024,
    2025,
    2026
   ],
   "students": 1
  },
  {
   "school": "berkeley",
   "pi": "Brian A. Barsky",
   "departments": [
    "EECS"
   ],
   "rank": "emeritus",
   "title": "Professor Emeritus, Professor in the Graduate School",
   "diagnosis": "no_output_found",
   "verdict": "zero_is_right",
   "reason": "Advises 86 EECS M.S. reports and 9 undergraduates (EECS tech reports name him advisor) but authored no 2016-2026 work: OpenAlex author A5046623635 has 0 works in 2016-2026 and DBLP has none.",
   "evidence": [
    "https://api.openalex.org/works?filter=author.id:A5046623635,publication_year:2016-2026"
   ],
   "funnel": {
    "dblpTitles": 0,
    "dblpDois": 0,
    "verifiedWorks": 0
   },
   "outside_appointment_by_year": {},
   "periods": [],
   "listing_years": [
    2016,
    2017,
    2018,
    2019,
    2020,
    2021,
    2022,
    2023,
    2024,
    2025,
    2026
   ],
   "students": 99
  }
 ],
 "zero_students": [],
 "counts": {
  "berkeley:zero_papers:zero_is_right": 1,
  "cmu:zero_papers:zero_is_right": 2,
  "epfl:zero_papers:zero_is_right": 2,
  "mit:zero_papers:zero_is_right": 2,
  "princeton:zero_papers:zero_is_right": 3
 }
}